{
  "version": "loupe-ir/v1",
  "root": "engine",
  "entities": [
    {
      "id": "engine",
      "label": "Liquid Rocket Engine",
      "kind": "assembly",
      "parent": null,
      "lod_band": 0,
      "payload": {
        "type": "none"
      },
      "content_tiers": {
        "overview": "Bipropellant liquid rocket engine.",
        "detail": "Turbopump-fed, regeneratively cooled."
      }
    },
    {
      "id": "nozzle",
      "label": "Bell Nozzle",
      "kind": "part",
      "parent": "engine",
      "placement": {
        "pos": [
          0,
          0.5,
          0
        ],
        "rot": [
          0,
          0,
          0
        ],
        "scale": [
          1,
          1,
          1
        ]
      },
      "lod_band": 0,
      "payload": {
        "type": "mesh",
        "data": {
          "shape": "revolve",
          "profile": [
            [
              0.42,
              -0.0
            ],
            [
              0.6107,
              -0.1278
            ],
            [
              0.709,
              -0.2556
            ],
            [
              0.7886,
              -0.3833
            ],
            [
              0.858,
              -0.5111
            ],
            [
              0.9208,
              -0.6389
            ],
            [
              0.9787,
              -0.7667
            ],
            [
              1.0328,
              -0.8944
            ],
            [
              1.0839,
              -1.0222
            ],
            [
              1.1325,
              -1.15
            ],
            [
              1.179,
              -1.2778
            ],
            [
              1.2237,
              -1.4056
            ],
            [
              1.2668,
              -1.5333
            ],
            [
              1.3084,
              -1.6611
            ],
            [
              1.3488,
              -1.7889
            ],
            [
              1.3881,
              -1.9167
            ],
            [
              1.4263,
              -2.0444
            ],
            [
              1.4636,
              -2.1722
            ],
            [
              1.5,
              -2.3
            ]
          ],
          "segments": 64,
          "color": [
            0.3,
            0.72,
            1.0
          ],
          "glow": 1.5
        }
      },
      "content_tiers": {
        "overview": "Bell nozzle.",
        "detail": "Expands exhaust to supersonic flow."
      }
    },
    {
      "id": "chamber",
      "label": "Combustion Chamber",
      "kind": "part",
      "parent": "engine",
      "placement": {
        "pos": [
          0,
          0.4,
          0
        ],
        "rot": [
          0,
          0,
          0
        ],
        "scale": [
          1,
          1,
          1
        ]
      },
      "lod_band": 0,
      "payload": {
        "type": "mesh",
        "data": {
          "shape": "revolve",
          "profile": [
            [
              0.62,
              0.0
            ],
            [
              0.62,
              1.1
            ],
            [
              0.6081,
              1.2089
            ],
            [
              0.5728,
              1.3135
            ],
            [
              0.5155,
              1.41
            ],
            [
              0.4384,
              1.4946
            ],
            [
              0.3445,
              1.564
            ],
            [
              0.2373,
              1.6155
            ],
            [
              0.121,
              1.6473
            ],
            [
              0.0,
              1.658
            ]
          ],
          "segments": 56,
          "color": [
            0.4,
            0.8,
            1.0
          ],
          "glow": 1.4
        }
      },
      "content_tiers": {
        "overview": "Combustion chamber.",
        "detail": "Propellants burn at high pressure."
      }
    },
    {
      "id": "injector",
      "label": "Injector Plate",
      "kind": "feature",
      "parent": "chamber",
      "placement": {
        "pos": [
          0,
          1.5,
          0
        ],
        "rot": [
          0,
          0,
          0
        ],
        "scale": [
          1,
          1,
          1
        ]
      },
      "lod_band": 1,
      "payload": {
        "type": "mesh",
        "data": {
          "shape": "torus",
          "size": [
            0.9,
            0.2,
            0.9
          ],
          "color": [
            0.6,
            0.9,
            1.0
          ],
          "glow": 1.9
        }
      },
      "content_tiers": {
        "overview": "Injector.",
        "detail": "Atomizes and mixes fuel + oxidizer."
      }
    },
    {
      "id": "turbopump",
      "label": "Turbopump",
      "kind": "part",
      "parent": "engine",
      "placement": {
        "pos": [
          1.7,
          0.5,
          0
        ],
        "rot": [
          0,
          0,
          0
        ],
        "scale": [
          1,
          1,
          1
        ]
      },
      "lod_band": 0,
      "payload": {
        "type": "mesh",
        "data": {
          "shape": "revolve",
          "profile": [
            [
              0.0,
              0.6
            ],
            [
              0.45,
              0.55
            ],
            [
              0.5,
              0.2
            ],
            [
              0.5,
              -0.2
            ],
            [
              0.3,
              -0.5
            ],
            [
              0.0,
              -0.55
            ]
          ],
          "segments": 40,
          "color": [
            0.55,
            0.75,
            1.0
          ],
          "glow": 1.3
        }
      },
      "content_tiers": {
        "overview": "Turbopump.",
        "detail": "Pressurizes propellants before injection."
      }
    },
    {
      "id": "feedline",
      "label": "Propellant Feedline",
      "kind": "feature",
      "parent": "engine",
      "placement": {
        "pos": [
          0,
          0,
          0
        ],
        "rot": [
          0,
          0,
          0
        ],
        "scale": [
          1,
          1,
          1
        ]
      },
      "lod_band": 1,
      "payload": {
        "type": "mesh",
        "data": {
          "shape": "tube",
          "path": [
            [
              1.7,
              0.5,
              0
            ],
            [
              1.0,
              0.9,
              0
            ],
            [
              0.4,
              1.4,
              0
            ],
            [
              0.0,
              1.7,
              0
            ]
          ],
          "radius": 0.07,
          "sides": 12,
          "color": [
            0.7,
            0.85,
            1.0
          ],
          "glow": 1.6
        }
      },
      "content_tiers": {
        "overview": "Feedline.",
        "detail": "Carries pressurized propellant to the injector."
      }
    }
  ],
  "relations": [
    {
      "from": "turbopump",
      "to": "feedline",
      "kind": "feeds"
    },
    {
      "from": "feedline",
      "to": "injector",
      "kind": "feeds"
    },
    {
      "from": "injector",
      "to": "chamber",
      "kind": "feeds"
    },
    {
      "from": "chamber",
      "to": "nozzle",
      "kind": "flow"
    }
  ],
  "lod_policy": {
    "bands": 3,
    "distance_thresholds": [
      5.5,
      3.0
    ]
  },
  "provenance": {
    "source": "examples\\rocket_engine.blueprint.json",
    "hash": "f5da6817a2aed226488486215bebdbefb82c0ff66b9c5500ef110b9c2dd747cb",
    "generated_at": "2026-06-23T12:56:28",
    "generator": "loupe-ingest/blueprint"
  }
}