{
  "version": "loupe-ir/v1",
  "root": "model",
  "entities": [
    {
      "id": "model",
      "label": "U-Net",
      "kind": "model",
      "parent": null,
      "placement": {
        "pos": [
          0.0,
          1.7,
          0.0
        ],
        "rot": [
          0.0,
          0.0,
          0.0
        ],
        "scale": [
          1.0,
          1.0,
          1.0
        ]
      },
      "lod_band": 0,
      "payload": {
        "type": "text",
        "data": {
          "accent": [
            0.45,
            0.85,
            1.0
          ],
          "width": 2.4,
          "height": 1.1
        }
      },
      "content_tiers": {
        "overview": "Encoder-decoder with skip connections (segmentation/denoising)",
        "detail": "downsample path -> bottleneck -> upsample path + skips",
        "deep": "skip links pass fine detail across the U"
      }
    },
    {
      "id": "in",
      "label": "Input",
      "kind": "input",
      "parent": "model",
      "placement": {
        "pos": [
          -6.0,
          0.0,
          0.0
        ],
        "rot": [
          0.0,
          0.0,
          0.0
        ],
        "scale": [
          1.0,
          1.0,
          1.0
        ]
      },
      "lod_band": 1,
      "payload": {
        "type": "matrix",
        "data": {
          "square": true,
          "accent": [
            0.6,
            0.95,
            0.7
          ]
        }
      },
      "content_tiers": {
        "overview": "image"
      }
    },
    {
      "id": "down",
      "label": "Down (encoder)",
      "kind": "block",
      "parent": "model",
      "placement": {
        "pos": [
          -3.0,
          0.0,
          0.0
        ],
        "rot": [
          0.0,
          0.0,
          0.0
        ],
        "scale": [
          0.97,
          0.97,
          0.97
        ]
      },
      "lod_band": 1,
      "payload": {
        "type": "text",
        "data": {
          "accent": [
            0.5,
            0.85,
            1.0
          ],
          "width": 1.4,
          "height": 0.9,
          "eqn": "conv"
        }
      },
      "content_tiers": {
        "overview": "conv + downsample"
      }
    },
    {
      "id": "down_mech",
      "label": "Down (encoder)",
      "kind": "mechanism",
      "parent": "down",
      "placement": {
        "pos": [
          0.0,
          0.0,
          0.0
        ],
        "rot": [
          0.0,
          0.0,
          0.0
        ],
        "scale": [
          0.85,
          0.85,
          0.85
        ]
      },
      "lod_band": 2,
      "payload": {
        "type": "conv",
        "data": {
          "in": 9,
          "k": 3,
          "stride": 1,
          "pad": 1,
          "accent": [
            0.5,
            0.85,
            1.0
          ],
          "eqn": "conv"
        }
      },
      "content_tiers": {
        "overview": "conv + downsample"
      }
    },
    {
      "id": "bottle",
      "label": "Bottleneck",
      "kind": "mechanism",
      "parent": "model",
      "placement": {
        "pos": [
          0.0,
          0.0,
          0.0
        ],
        "rot": [
          0.0,
          0.0,
          0.0
        ],
        "scale": [
          0.94,
          0.94,
          0.94
        ]
      },
      "lod_band": 1,
      "payload": {
        "type": "matrix",
        "data": {
          "square": true,
          "accent": [
            0.55,
            0.95,
            1.0
          ],
          "eqn": "conv"
        }
      },
      "content_tiers": {
        "overview": "smallest spatial, richest features"
      }
    },
    {
      "id": "up",
      "label": "Up (decoder + skips)",
      "kind": "block",
      "parent": "model",
      "placement": {
        "pos": [
          3.0,
          0.0,
          0.0
        ],
        "rot": [
          0.0,
          0.0,
          0.0
        ],
        "scale": [
          0.91,
          0.91,
          0.91
        ]
      },
      "lod_band": 1,
      "payload": {
        "type": "text",
        "data": {
          "accent": [
            0.5,
            0.95,
            0.8
          ],
          "width": 1.4,
          "height": 0.9,
          "eqn": "conv"
        }
      },
      "content_tiers": {
        "overview": "upsample + concat skip"
      }
    },
    {
      "id": "up_mech",
      "label": "Up (decoder + skips)",
      "kind": "mechanism",
      "parent": "up",
      "placement": {
        "pos": [
          0.0,
          0.0,
          0.0
        ],
        "rot": [
          0.0,
          0.0,
          0.0
        ],
        "scale": [
          0.85,
          0.85,
          0.85
        ]
      },
      "lod_band": 2,
      "payload": {
        "type": "conv",
        "data": {
          "in": 9,
          "k": 3,
          "stride": 1,
          "pad": 1,
          "accent": [
            0.5,
            0.95,
            0.8
          ],
          "eqn": "conv"
        }
      },
      "content_tiers": {
        "overview": "upsample + concat skip"
      }
    },
    {
      "id": "out",
      "label": "Output",
      "kind": "output",
      "parent": "model",
      "placement": {
        "pos": [
          6.0,
          0.0,
          0.0
        ],
        "rot": [
          0.0,
          0.0,
          0.0
        ],
        "scale": [
          0.88,
          0.88,
          0.88
        ]
      },
      "lod_band": 1,
      "payload": {
        "type": "matrix",
        "data": {
          "square": true,
          "accent": [
            0.95,
            0.7,
            0.4
          ]
        }
      },
      "content_tiers": {
        "overview": "per-pixel prediction"
      }
    }
  ],
  "relations": [
    {
      "from": "in",
      "to": "down",
      "kind": "flow"
    },
    {
      "from": "down",
      "to": "bottle",
      "kind": "flow"
    },
    {
      "from": "bottle",
      "to": "up",
      "kind": "flow"
    },
    {
      "from": "up",
      "to": "out",
      "kind": "flow"
    }
  ],
  "lod_policy": {
    "bands": 3,
    "distance_thresholds": [
      7.0,
      3.6
    ]
  },
  "provenance": {
    "source": "modelarch:unet",
    "hash": "0e735170a337692b961775c6d988b99fbdbd377ce07b0da4ae6b5b05b1bf20f6",
    "generated_at": "2026-06-29T14:05:36",
    "generator": "model_architecture adapter"
  }
}