{
  "version": "loupe-ir/v1", "root": "model",
  "provenance": { "source": "hand-authored", "generated_at": "2026-06-29", "generator": "loupe model-architecture exemplar" },
  "lod_policy": { "bands": 4, "distance_thresholds": [7.0, 4.0, 2.2] },
  "entities": [
    { "id": "model", "label": "GPT-2 small", "kind": "model", "parent": null, "lod_band": 0, "placement": { "pos": [0,0,0] }, "payload": { "type": "text", "data": { "accent": [0.45,0.85,1.0], "width": 2.4, "height": 1.1 } }, "content_tiers": { "overview": "Decoder-only LM: text in, next-token out", "detail": "12 layers; 12 heads; width 768", "deep": "Embeddings -> 12 blocks -> output head" } },
    { "id": "embeddings", "label": "Input Embeddings", "kind": "input", "parent": "model", "lod_band": 1, "placement": { "pos": [-3.4,0,0] }, "payload": { "type": "matrix", "data": { "rows": 50257, "cols": 768, "accent": [0.5,0.9,0.7], "note": "token + position", "eqn": "embed" } }, "content_tiers": { "overview": "Token id -> 768-d vector, plus position" } },
    { "id": "block0", "label": "Decoder Block", "kind": "block", "parent": "model", "lod_band": 1, "placement": { "pos": [0,0,0] }, "payload": { "type": "text", "data": { "accent": [0.4,0.8,1.0], "width": 1.4, "height": 0.9 } }, "content_tiers": { "overview": "Self-Attention then MLP; residual + LayerNorm" } },
    { "id": "ln1", "label": "LayerNorm 1", "kind": "norm", "parent": "block0", "lod_band": 2, "placement": { "pos": [-4.2,0,0], "scale": [0.7,0.7,0.7] }, "payload": { "type": "text", "data": { "accent": [0.6,0.7,0.9], "width": 1.0, "height": 0.6, "eqn": "layernorm" } }, "content_tiers": { "overview": "Normalizes before attention" } },
    { "id": "attn", "label": "Self-Attention", "kind": "mechanism", "parent": "block0", "lod_band": 2, "placement": { "pos": [-1.4,0,0], "scale": [0.85,0.85,0.85] }, "payload": { "type": "attention", "data": { "seq": 8, "d_model": 768, "n_heads": 12, "head": 0, "accent": [0.55,0.95,1.0], "eqn": "attention" } }, "content_tiers": { "overview": "Each token mixes info from earlier tokens", "detail": "Attn = softmax(QK^T / sqrt dk) V; 12 heads in parallel", "deep": "Q,K,V project x; scores rank relevance; out = weighted sum of V" } },
    { "id": "mlp", "label": "Feed-Forward", "kind": "transform", "parent": "block0", "lod_band": 2, "placement": { "pos": [2.4,0,0], "scale": [0.8,0.8,0.8] }, "payload": { "type": "matrix", "data": { "rows": 768, "cols": 3072, "accent": [0.5,0.95,0.8], "note": "768-3072-768", "eqn": "mlp" } }, "content_tiers": { "overview": "Expand, GELU, project back" } },
    { "id": "ln2", "label": "LayerNorm 2", "kind": "norm", "parent": "block0", "lod_band": 2, "placement": { "pos": [5.0,0,0], "scale": [0.7,0.7,0.7] }, "payload": { "type": "text", "data": { "accent": [0.6,0.7,0.9], "width": 1.0, "height": 0.6, "eqn": "layernorm" } }, "content_tiers": { "overview": "Normalizes before the MLP" } },
    { "id": "qkv", "label": "Linear  Q K V", "kind": "proj", "parent": "attn", "lod_band": 3, "placement": { "pos": [0,2.8,0], "scale": [0.7,0.7,0.7] }, "payload": { "type": "text", "data": { "accent": [0.7,0.9,1.0], "width": 1.8, "height": 0.5, "eqn": "qkv" } }, "content_tiers": { "overview": "Project x into Query, Key, Value; split across heads" } },
    { "id": "h0", "label": "prev-token", "kind": "head", "parent": "attn", "lod_band": 3, "placement": { "pos": [0,0,-0], "scale": [0.5,0.5,0.5] }, "payload": { "type": "matrix", "data": { "pulse": true, "glow": 0.45, "title": "scaled dot-product attention  x12", "eqn": "attention", "accent": [0.6,0.9,1.0], "values": [[1,0,0,0,0,0,0,0],[1,1,0,0,0,0,0,0],[1,1,1,0,0,0,0,0],[1,1,1,1,0,0,0,0],[1,1,1,1,1,0,0,0],[1,1,1,1,1,1,0,0],[1,1,1,1,1,1,1,0],[1,1,1,1,1,1,1,1]] } }, "content_tiers": {} },
    { "id": "h1", "label": "BOS sink", "kind": "head", "parent": "attn", "lod_band": 3, "placement": { "pos": [0.06,0,-0.9], "scale": [0.5,0.5,0.5] }, "payload": { "type": "matrix", "data": { "pulse": true, "glow": 0.45, "accent": [0.6,0.9,1.0], "values": [[1,0,0,0,0,0,0,0],[1,1,0,0,0,0,0,0],[1,1,1,0,0,0,0,0],[1,1,1,1,0,0,0,0],[1,1,1,1,1,0,0,0],[1,1,1,1,1,1,0,0],[1,1,1,1,1,1,1,0],[1,1,1,1,1,1,1,1]] } }, "content_tiers": {} },
    { "id": "h2", "label": "induction", "kind": "head", "parent": "attn", "lod_band": 3, "placement": { "pos": [0.12,0,-1.8], "scale": [0.5,0.5,0.5] }, "payload": { "type": "matrix", "data": { "pulse": true, "glow": 0.45, "accent": [0.6,0.9,1.0], "values": [[1,0,0,0,0,0,0,0],[1,1,0,0,0,0,0,0],[1,1,1,0,0,0,0,0],[1,1,1,1,0,0,0,0],[1,1,1,1,1,0,0,0],[1,1,1,1,1,1,0,0],[1,1,1,1,1,1,1,0],[1,1,1,1,1,1,1,1]] } }, "content_tiers": {} },
    { "id": "h3", "label": "duplicate", "kind": "head", "parent": "attn", "lod_band": 3, "placement": { "pos": [0.18,0,-2.7], "scale": [0.5,0.5,0.5] }, "payload": { "type": "matrix", "data": { "pulse": true, "glow": 0.45, "accent": [0.6,0.9,1.0], "values": [[1,0,0,0,0,0,0,0],[1,1,0,0,0,0,0,0],[1,1,1,0,0,0,0,0],[1,1,1,1,0,0,0,0],[1,1,1,1,1,0,0,0],[1,1,1,1,1,1,0,0],[1,1,1,1,1,1,1,0],[1,1,1,1,1,1,1,1]] } }, "content_tiers": {} },
    { "id": "h4", "label": "name-mover", "kind": "head", "parent": "attn", "lod_band": 3, "placement": { "pos": [0.24,0,-3.6], "scale": [0.5,0.5,0.5] }, "payload": { "type": "matrix", "data": { "pulse": true, "glow": 0.45, "accent": [0.6,0.9,1.0], "values": [[1,0,0,0,0,0,0,0],[1,1,0,0,0,0,0,0],[1,1,1,0,0,0,0,0],[1,1,1,1,0,0,0,0],[1,1,1,1,1,0,0,0],[1,1,1,1,1,1,0,0],[1,1,1,1,1,1,1,0],[1,1,1,1,1,1,1,1]] } }, "content_tiers": {} },
    { "id": "h5", "label": "positional", "kind": "head", "parent": "attn", "lod_band": 3, "placement": { "pos": [0.3,0,-4.5], "scale": [0.5,0.5,0.5] }, "payload": { "type": "matrix", "data": { "pulse": true, "glow": 0.45, "accent": [0.6,0.9,1.0], "values": [[1,0,0,0,0,0,0,0],[1,1,0,0,0,0,0,0],[1,1,1,0,0,0,0,0],[1,1,1,1,0,0,0,0],[1,1,1,1,1,0,0,0],[1,1,1,1,1,1,0,0],[1,1,1,1,1,1,1,0],[1,1,1,1,1,1,1,1]] } }, "content_tiers": {} },
    { "id": "h6", "label": "syntactic", "kind": "head", "parent": "attn", "lod_band": 3, "placement": { "pos": [0.36,0,-5.4], "scale": [0.5,0.5,0.5] }, "payload": { "type": "matrix", "data": { "pulse": true, "glow": 0.45, "accent": [0.6,0.9,1.0], "values": [[1,0,0,0,0,0,0,0],[1,1,0,0,0,0,0,0],[1,1,1,0,0,0,0,0],[1,1,1,1,0,0,0,0],[1,1,1,1,1,0,0,0],[1,1,1,1,1,1,0,0],[1,1,1,1,1,1,1,0],[1,1,1,1,1,1,1,1]] } }, "content_tiers": {} },
    { "id": "h7", "label": "copy", "kind": "head", "parent": "attn", "lod_band": 3, "placement": { "pos": [0.42,0,-6.3], "scale": [0.5,0.5,0.5] }, "payload": { "type": "matrix", "data": { "pulse": true, "glow": 0.45, "accent": [0.6,0.9,1.0], "values": [[1,0,0,0,0,0,0,0],[1,1,0,0,0,0,0,0],[1,1,1,0,0,0,0,0],[1,1,1,1,0,0,0,0],[1,1,1,1,1,0,0,0],[1,1,1,1,1,1,0,0],[1,1,1,1,1,1,1,0],[1,1,1,1,1,1,1,1]] } }, "content_tiers": {} },
    { "id": "h8", "label": "rare-token", "kind": "head", "parent": "attn", "lod_band": 3, "placement": { "pos": [0.48,0,-7.2], "scale": [0.5,0.5,0.5] }, "payload": { "type": "matrix", "data": { "pulse": true, "glow": 0.45, "accent": [0.6,0.9,1.0], "values": [[1,0,0,0,0,0,0,0],[1,1,0,0,0,0,0,0],[1,1,1,0,0,0,0,0],[1,1,1,1,0,0,0,0],[1,1,1,1,1,0,0,0],[1,1,1,1,1,1,0,0],[1,1,1,1,1,1,1,0],[1,1,1,1,1,1,1,1]] } }, "content_tiers": {} },
    { "id": "h9", "label": "current", "kind": "head", "parent": "attn", "lod_band": 3, "placement": { "pos": [0.54,0,-8.1], "scale": [0.5,0.5,0.5] }, "payload": { "type": "matrix", "data": { "pulse": true, "glow": 0.45, "accent": [0.6,0.9,1.0], "values": [[1,0,0,0,0,0,0,0],[1,1,0,0,0,0,0,0],[1,1,1,0,0,0,0,0],[1,1,1,1,0,0,0,0],[1,1,1,1,1,0,0,0],[1,1,1,1,1,1,0,0],[1,1,1,1,1,1,1,0],[1,1,1,1,1,1,1,1]] } }, "content_tiers": {} },
    { "id": "h10", "label": "subword", "kind": "head", "parent": "attn", "lod_band": 3, "placement": { "pos": [0.6,0,-9], "scale": [0.5,0.5,0.5] }, "payload": { "type": "matrix", "data": { "pulse": true, "glow": 0.45, "accent": [0.6,0.9,1.0], "values": [[1,0,0,0,0,0,0,0],[1,1,0,0,0,0,0,0],[1,1,1,0,0,0,0,0],[1,1,1,1,0,0,0,0],[1,1,1,1,1,0,0,0],[1,1,1,1,1,1,0,0],[1,1,1,1,1,1,1,0],[1,1,1,1,1,1,1,1]] } }, "content_tiers": {} },
    { "id": "h11", "label": "punctuation", "kind": "head", "parent": "attn", "lod_band": 3, "placement": { "pos": [0.66,0,-9.9], "scale": [0.5,0.5,0.5] }, "payload": { "type": "matrix", "data": { "pulse": true, "glow": 0.45, "accent": [0.6,0.9,1.0], "values": [[1,0,0,0,0,0,0,0],[1,1,0,0,0,0,0,0],[1,1,1,0,0,0,0,0],[1,1,1,1,0,0,0,0],[1,1,1,1,1,0,0,0],[1,1,1,1,1,1,0,0],[1,1,1,1,1,1,1,0],[1,1,1,1,1,1,1,1]] } }, "content_tiers": {} }
,
    { "id": "concat", "label": "Concat", "kind": "proj", "parent": "attn", "lod_band": 3, "placement": { "pos": [0,-1.6,0], "scale": [0.7,0.7,0.7] }, "payload": { "type": "text", "data": { "accent": [0.9,0.9,0.7], "width": 1.6, "height": 0.45 } }, "content_tiers": { "overview": "Join all 12 head outputs" } },
    { "id": "wo", "label": "Linear  W_O", "kind": "output", "parent": "attn", "lod_band": 3, "placement": { "pos": [0,-2.7,0], "scale": [0.7,0.7,0.7] }, "payload": { "type": "text", "data": { "accent": [0.95,0.85,0.6], "width": 1.6, "height": 0.5, "eqn": "concat" } }, "content_tiers": { "overview": "out = concat(heads) W_O; project to 768" } },
    { "id": "lm_head", "label": "Output Head", "kind": "output", "parent": "model", "lod_band": 1, "placement": { "pos": [3.4,0,0] }, "payload": { "type": "matrix", "data": { "rows": 768, "cols": 50257, "accent": [0.95,0.7,0.4], "note": "to vocab", "eqn": "softmax" } }, "content_tiers": { "overview": "Scores 50,257 tokens; softmax = next-token probs" } }
  ],
  "relations": [
    { "from": "embeddings", "to": "block0", "kind": "flow" }, { "from": "block0", "to": "lm_head", "kind": "flow" },
    { "from": "ln1", "to": "attn", "kind": "flow" }, { "from": "attn", "to": "mlp", "kind": "flow" }, { "from": "mlp", "to": "ln2", "kind": "flow" },
    { "from": "qkv", "to": "h0", "kind": "flow" }, { "from": "h0", "to": "concat", "kind": "flow" }, { "from": "concat", "to": "wo", "kind": "flow" }
  ]
}
























