{
  "version": "loupe-ir/v1",
  "root": "model",
  "entities": [
    {
      "id": "model",
      "label": "ResNet",
      "kind": "model",
      "parent": null,
      "placement": {
        "pos": [
          0.0,
          1.7,
          0.0
        ],
        "rot": [
          0.0,
          0.0,
          0.0
        ],
        "scale": [
          1.0,
          1.0,
          1.0
        ]
      },
      "lod_band": 0,
      "payload": {
        "type": "text",
        "data": {
          "accent": [
            0.45,
            0.85,
            1.0
          ],
          "width": 2.4,
          "height": 1.1
        }
      },
      "content_tiers": {
        "overview": "Deep CNN with residual (skip) connections",
        "detail": "conv stem -> 4 residual stages -> pool -> FC",
        "deep": "skip connections ease deep training"
      }
    },
    {
      "id": "stem",
      "label": "Conv Stem 7x7",
      "kind": "input",
      "parent": "model",
      "placement": {
        "pos": [
          -4.5,
          0.0,
          0.0
        ],
        "rot": [
          0.0,
          0.0,
          0.0
        ],
        "scale": [
          1.0,
          1.0,
          1.0
        ]
      },
      "lod_band": 1,
      "payload": {
        "type": "matrix",
        "data": {
          "square": true,
          "accent": [
            0.6,
            0.95,
            0.7
          ],
          "eqn": "conv"
        }
      },
      "content_tiers": {
        "overview": "7x7 conv, stride 2, max-pool"
      }
    },
    {
      "id": "s1",
      "label": "Stage 1 (x3)",
      "kind": "block",
      "parent": "model",
      "placement": {
        "pos": [
          -1.5,
          0.0,
          0.0
        ],
        "rot": [
          0.0,
          0.0,
          0.0
        ],
        "scale": [
          0.97,
          0.97,
          0.97
        ]
      },
      "lod_band": 1,
      "payload": {
        "type": "matrix",
        "data": {
          "square": true,
          "accent": [
            0.5,
            0.85,
            1.0
          ],
          "eqn": "conv"
        }
      },
      "content_tiers": {
        "overview": "residual blocks; dive to see skip"
      }
    },
    {
      "id": "c1",
      "label": "conv 3x3",
      "kind": "head",
      "parent": "s1",
      "placement": {
        "pos": [
          -2.2,
          0.0,
          0.0
        ],
        "rot": [
          0.0,
          0.0,
          0.0
        ],
        "scale": [
          0.6,
          0.6,
          0.6
        ]
      },
      "lod_band": 2,
      "payload": {
        "type": "conv",
        "data": {
          "in": 7,
          "k": 3,
          "stride": 1,
          "pad": 1,
          "accent": [
            0.6,
            0.9,
            1.0
          ],
          "eqn": "conv"
        }
      },
      "content_tiers": {
        "overview": "first conv"
      }
    },
    {
      "id": "c2",
      "label": "conv 3x3",
      "kind": "head",
      "parent": "s1",
      "placement": {
        "pos": [
          0.0,
          0.0,
          0.0
        ],
        "rot": [
          0.0,
          0.0,
          0.0
        ],
        "scale": [
          0.6,
          0.6,
          0.6
        ]
      },
      "lod_band": 2,
      "payload": {
        "type": "conv",
        "data": {
          "in": 7,
          "k": 3,
          "stride": 1,
          "pad": 1,
          "accent": [
            0.6,
            0.9,
            1.0
          ],
          "eqn": "conv"
        }
      },
      "content_tiers": {
        "overview": "second conv"
      }
    },
    {
      "id": "add",
      "label": "+ skip",
      "kind": "head",
      "parent": "s1",
      "placement": {
        "pos": [
          2.2,
          0.0,
          0.0
        ],
        "rot": [
          0.0,
          0.0,
          0.0
        ],
        "scale": [
          0.6,
          0.6,
          0.6
        ]
      },
      "lod_band": 2,
      "payload": {
        "type": "text",
        "data": {
          "accent": [
            0.6,
            1.0,
            0.7
          ]
        }
      },
      "content_tiers": {
        "overview": "add input back (residual)"
      }
    },
    {
      "id": "s2",
      "label": "Stage 2-4",
      "kind": "block",
      "parent": "model",
      "placement": {
        "pos": [
          1.5,
          0.0,
          0.0
        ],
        "rot": [
          0.0,
          0.0,
          0.0
        ],
        "scale": [
          0.94,
          0.94,
          0.94
        ]
      },
      "lod_band": 1,
      "payload": {
        "type": "matrix",
        "data": {
          "square": true,
          "accent": [
            0.5,
            0.85,
            1.0
          ],
          "eqn": "conv"
        }
      },
      "content_tiers": {
        "overview": "deeper residual stages"
      }
    },
    {
      "id": "fc",
      "label": "Pool + FC",
      "kind": "output",
      "parent": "model",
      "placement": {
        "pos": [
          4.5,
          0.0,
          0.0
        ],
        "rot": [
          0.0,
          0.0,
          0.0
        ],
        "scale": [
          0.91,
          0.91,
          0.91
        ]
      },
      "lod_band": 1,
      "payload": {
        "type": "matrix",
        "data": {
          "rows": 2048,
          "cols": 1000,
          "accent": [
            0.95,
            0.7,
            0.4
          ],
          "eqn": "softmax"
        }
      },
      "content_tiers": {
        "overview": "global avg pool to 1000 classes"
      }
    }
  ],
  "relations": [
    {
      "from": "stem",
      "to": "s1",
      "kind": "flow"
    },
    {
      "from": "c1",
      "to": "c2",
      "kind": "flow"
    },
    {
      "from": "c2",
      "to": "add",
      "kind": "flow"
    },
    {
      "from": "s1",
      "to": "s2",
      "kind": "flow"
    },
    {
      "from": "s2",
      "to": "fc",
      "kind": "flow"
    }
  ],
  "lod_policy": {
    "bands": 3,
    "distance_thresholds": [
      7.0,
      3.6
    ]
  },
  "provenance": {
    "source": "modelarch:resnet",
    "hash": "edebee197b0f3992213263c8bce3e2e7c8dc1dd2c36862b5c9e319036ee12e9f",
    "generated_at": "2026-06-29T14:05:36",
    "generator": "model_architecture adapter"
  }
}